{
  "SCHEMA": "aiv.user-config.v1",
  "CONFIG_REVISION": 1,
  "USER_ID": "usr_00000000000000000000000000000000",
  "AIV_ID": "aiv_11111111111111111111111111111111",
  "POLICY_ID": "aiv-privacy-v1",
  "CONSENT": {
    "ENCRYPTED_PRIVATE_BACKUP": false,
    "SHARE_COLLECTIVE_STATISTICS": false
  },
  "DESTINATIONS": {
    "PRIVATE_VAULT": "NOT_CONFIGURED",
    "COLLECTIVE_ANALYTICS": "DISABLED"
  },
  "SECURITY_STATE": "NOT_ENROLLED"
}
